<!ELEMENT biblioteca (libro)+>
<!ELEMENT libro (título, autores, año)>
<!ELEMENT título (#PCDATA)>
<!ELEMENT autores (autor+)>
<!ELEMENT autor (nombre, apellido, nacionalidad)>
<!ELEMENT nombre (#PCDATA)>
<!ELEMENT apellido (#PCDATA)>
<!ELEMENT nacionalidad (#PCDATA)>
<!ELEMENT año (#PCDATA)>
<!ATTLIST libro idlibro ID #REQUIRED>
<!ATTLIST libro género CDATA #IMPLIED>
<!ATTLIST libro idioma CDATA "Español">
<!ATTLIST libro formato (impreso|digital) "impreso">
<!ATTLIST libro ref IDREFS #IMPLIED>